<?xml version="1.0" encoding="GB18030"?>
<!--Sample XML file generated by XMLSpy v2009 (http://www.altova.com)-->
<batch xsi:noNamespaceSchemaLocation="index.xsd" xmlns:xsi="http://www.w3.org/2001/XMLSchema-instance">
	<business_info modi_time="2001-12-17T09:30:47Z" modi_meta="Y">
		<biz_metadata1>aaaaaaaaaaaaaaaaaaaaaaaaaaaaaaaaaaaaaaaaaaaaaaaaaaaaaaaaaaaaaaaa</biz_metadata1>
		<biz_metadata2>aaaaaaaaaaaaaaaaaaaaaaaaaaaaaaaaaaaaaaaaaaaaaaaaaaaaaaaaaaaaaaaa</biz_metadata2>
		<biz_metadata3>aaaaaaaaaaaaaaaaaaaaaaaaaaaaaaaaaaaaaaaaaaaaaaaaaaaaaaaaaaaaaaaa</biz_metadata3>
		<source_system>aa</source_system>
		<create_province>aaaaa</create_province>
		<check_telno>aaaaaaaaaaaaaaaaaaaa</check_telno>
		<achr_sec>aa</achr_sec>
		<cust_no>aaaaaaaaaaaaaaaaa</cust_no>
		<docs_info>
			<doc_info archieved="Y" data_type="aaaa" security="aa" expire_date="2001-12-17T09:30:47Z" modi_time="2001-12-17T09:30:47Z" new_version="Y" full_index="Y" modi_meta="Y" oper_type="A">
				<pkuuid>aaaaaaaaaaaaaaaaaaaaaaaaaaaaaaaa</pkuuid>
				<uniq_metadata>aaaaaaaaaaaaaaaaaaaaaaaaaaaaaaaaaaaaaaaaaaaaaaaaaaaaaaaaaaaaaaaa</uniq_metadata>
				<index_metadata1>aaaaaaaaaaaaaaaaaaaaaaaaaaaaaaaaaaaaaaaaaaaaaaaaaaaaaaaaaaaaaaaa</index_metadata1>
				<index_metadata2>aaaaaaaaaaaaaaaaaaaaaaaaaaaaaaaaaaaaaaaaaaaaaaaaaaaaaaaaaaaaaaaa</index_metadata2>
				<index_metadata3>aaaaaaaaaaaaaaaaaaaaaaaaaaaaaaaaaaaaaaaaaaaaaaaaaaaaaaaaaaaaaaaa</index_metadata3>
				<ext_metadata>aaaaaaaaaaaaaaaaaaaaaaaaaaaaaaaaaaaaaaaaaaaaaaaaaaaaaaaaaaaaaaaaaaaaaaaaaaaaaaaaaaaaaaaaaaaaaaaaaaaa</ext_metadata>
        <delete_page>
					<pagedel page_index="0"/>
				</delete_page>
				<pages>
					<page doc_index="0" modi_time="2001-12-17T09:30:47Z" old_doc_index="0" modi_range="M" file_name="aaaaaaaaaaaaaaaaaaaaaaaaaaaaaaaaaaaaaaaaaaaaaaaaaaaaaaaaaaaaaaaaaaaaaaaaaaaaaaaaaaaaaaaaaaaaaaaaaaaa" page_index="0" oper_type="A" old_page_flag="F" page_flag="F">
						<postil modi_time="2001-12-17T09:30:47Z" remark="aaaaaaaaaaaaaaaaaaaaaaaaaaaaaaaaaaaaaaaaaaaaaaaaaaaaaaaaaaaaaaaaaaaaaaaaaaaaaaaaaaaaaaaaaaaaaaaaaaaa" file_name="aaaaaaaaaaaaaaaaaaaaaaaaaaaaaaaaaaaaaaaaaaaaaaaaaaaaaaaaaaaaaaaaaaaaaaaaaaaaaaaaaaaaaaaaaaaaaaaaaaaa" oper_type="A"/>
					</page>
				</pages>
				<version_list>
					<ver modi_time="2001-12-17T09:30:47Z" modi_by="aaaaaaaaaaaaaaaaaaaaaaaaaaaaaaaa" ver_no="12.12"/>
				</version_list>
			</doc_info>
		</docs_info>
	</business_info>
</batch>
